Metric Name (CN),English Name,English Abbreviation,Category,Lower Bound,Upper Bound,Unit,Professional Interpretation,Recommendations,Applicable Scope,Health Interpretation,Aliases
Thyroxine,Thyroxine,T4,Thyroid Function,61,330,pmol/L,Thyroxine is a cellular product, a gray-white needle-like crystal. Thyroid cells synthesize and secrete thyroxine, including thyroxine (T4) and triiodothyronine (T3). Oral thyroxine is easily absorbed. T4 absorption rate is about 35.8% (not constant)," and T3 about 95% (relatively constant). Both bind plasma proteins at >99%. T4 can be deiodinated by 5' deiodinase to T3 to take effect, or deiodinated by other enzymes to reverse T3 and 3,3'-T2 for inactivation. T3 acts fast and strong but lasts shorter; T4 acts slower and weaker but lasts longer. It increases metabolic activity of various tissues, raises metabolic rate, and may cause sympathetic overexcitement with symptoms similar to hyperthyroidism. Common clinical forms include thyroid tablets and levothyroxine sodium. Mainly used for hypothyroidism or those with a tendency to deficiency.,Thyroxine is important; hypothyroid patients should ensure adequate replacement.,Mainly used for hypothyroidism or tendency to deficiency.,Thyroxine promotes intestinal glucose absorption, stimulates hepatic glycogen breakdown to glucose, and raises blood glucose. In hyperthyroidism, excessive thyroxine secretion accelerates metabolic oxidation, releasing excess heat; symptoms include sweating, heat intolerance, increased appetite but weight loss due to energy deficit, plus palpitations and exophthalmos.",
Alpha-fetoprotein,Alpha-fetoprotein,AFP,Tumor Marker,0,25,μg/L,Alpha-fetoprotein (AFP) is a glycoprotein in the albumin family, mainly synthesized by fetal liver cells and yolk sac. It is high in fetal circulation, declines after birth," and is extremely low in adult serum. AFP is closely related to the occurrence and development of liver cancer and various tumors, serving as a positive marker; clinically used mainly for diagnosis and therapeutic monitoring of primary liver cancer.,Dynamic observation of serum AFP helps differentiate benign vs malignant liver disease and aids early liver cancer diagnosis. AFP elevation should be judged with other tests.,Serum testing in children and adults; auxiliary diagnosis for liver cancer, hepatoblastoma, gonadal teratoblastoma, hepatitis, testicular cancer, ovarian tumors, malignant teratoma, pancreatic, gastric, intestinal, lung cancers.,In healthy adults AFP is very low. Pregnant women show AFP positivity physiologically. Elevation may indicate liver cancer or other malignancies, but benign liver disease can also raise it; further workup is needed.",
Alpha-fetoprotein quantitative,Alpha-fetoprotein quantitative,AFP,Tumor Marker,0,25,ng/ml,Elevated AFP levels may be associated with liver cancer, hepatitis, cirrhosis," or germ cell tumors. For patients with abnormal AFP, clinical presentation and other tests should be combined for comprehensive evaluation and individualized treatment. Regular AFP testing helps early detection and timely intervention to improve prognosis.,High-risk liver cancer populations (e.g., HBV/HCV, cirrhosis): check AFP every 6 months with liver ultrasound.",
Pregnant women: AFP is used for Down syndrome screening (with free β-HCG," etc.); abnormal elevation may relate to fetal neural tube defects.""",Adults,,,,,,,,,
Carcinoembryonic antigen,Carcinoembryonic antigen,CEA,Tumor Marker,0,2.5,ng/ml,Carcinoembryonic antigen is an acidic glycoprotein with human embryonic antigen properties, present in tumor cells derived from endodermal differentiation. Serum concentration correlates with many tumors, especially gastrointestinal cancers.,"CEA >20 ng/ml often suggests GI tumors; further evaluation recommended.,Used for auxiliary diagnosis and postoperative monitoring of colorectal, pancreatic, gastric, small cell lung, breast, medullary thyroid cancers.,97% of healthy adults have CEA <2.5 ng/ml. Elevation also seen in pregnancy, cardiovascular disease, diabetes, nonspecific colitis, etc.",
Carcinoembryonic antigen quantitative,Carcinoembryonic antigen quantitative,CEA,Tumor Marker,0,5,ug/L,CEA is an acidic glycoprotein with human embryonic antigen specificity, first extracted by Gold and Freedman in 1965 from colon cancer and embryonic tissue. Elevated CEA can be detected in various tumors, long-term smokers," and some non-malignant diseases.,Tumor markers require cautious interpretation. CEA is a pan-tumor marker elevated in many cancers (notably GI and lung). Elevation is not always malignancy—can rise in inflammation or pregnancy. If CEA >20 µg/L, rule out cancer. Also used to monitor treatment response/recurrence/metastasis; persistent or large rises warrant evaluation with imaging/ultrasound.,Adults,",
Leukocytes,Leukocytes,WBC,Blood Routine,4,10,×10^9/L,Elevation suggests infection/inflammation; decrease seen with chemotherapy/immunosuppression.,Marked elevation or low granulocytes: consult hematology.,"Adults, Children",Leukocytes are key immune components; count changes reflect immune status.,
White blood cell count,White blood cell count,WBC,Blood Routine,4,10,10^9/L,Leukocytes are crucial blood cells with roles in phagocytosis, antibody production, healing," pathogen defense, and immunity. Five subtypes: neutrophils 0.5–0.7, lymphocytes 0.2–0.4, monocytes 0.03–0.08, eosinophils 0.01–0.05, basophils <0.01. WBC count is often the first focus in CBC.,\""WBC elevation can be physiologic or pathologic. Reductions also matter.\n1. Physiologic rise: newborns, late pregnancy, labor, post-strenuous exercise.\n2. Pathologic rise: suppurative bacterial infection, uremia, leukemia, tissue injury, surgery, etc.\n3. Decrease: viral infection, typhoid/paratyphoid, kala-azar, malaria, aplastic anemia, post chemo/radiotherapy.\"",Adults,",
Leukocyte esterase,Leukocyte esterase,LEU,Urine Routine,Negative,Strong positive (2+),None,Leukocyte esterase is a neutrophil-specific enzyme. Positive indicates neutrophil infiltration and inflammation. Notes: 1) Only shows presence of neutrophils, not pathogen type; 2) 0.5–15 cells/μL can be positive; 3) Renal transplant rejection dominated by lymphocytes may yield false negatives; 4) Drugs/specimen factors can cause false positives/negatives.,1. Positive: combine symptoms/other tests (e.g.," urine culture) to define infection. 2. Use fresh urine. 3. Exclude drug interference (nitrofurantoin → false positive; gentamicin → false negative). 4. Negative cannot fully exclude infection; if suspect TB, investigate further.,1. UTI screening (pyelonephritis, UTI); 2. Vaginitis assessment (vaginal cleanliness); 3. Post–kidney transplant monitoring; 4. Routine check.,Negative suggests normal mucosa; weak+ (1+) may be menses/meds; strong+ (2+) implies clear inflammation—see doctor. Strenuous exercise/fever may cause transient positive.",
Albumin,Albumin,ALB,Liver Function,35,55,g/L,Low value suggests impaired hepatic synthesis or malnutrition; imbalance may indicate immune issues.,Adjust nutrition and assess liver/kidney function.,"Adults, Children",Albumin reflects nutrition and liver function.,
Direct bilirubin,Direct bilirubin,DBil,Liver Function,0,6.8,μmol/L,Direct bilirubin (DBil), aka conjugated bilirubin, forms when indirect bilirubin is conjugated with glucuronic acid in the liver. Water-soluble; reacts directly with diazo reagent and is excreted in urine. Liver metabolism involves uptake," conjugation, and excretion; elevation indicates post-hepatic excretion obstruction. Helps jaundice typing.,\""Elevation mainly in obstructive jaundice, hepatocellular jaundice, liver cancer, pancreatic head cancer, cholelithiasis, cholangiocarcinoma.\nJaundice differentiation:\n1. Hemolytic: excess indirect bilirubin from RBC destruction exceeds conjugation.\n2. Hepatocellular: liver damage reduces conjugation and obstructs canaliculi, raising both indirect and direct bilirubin.\n3. Obstructive: intra/extrahepatic blockage prevents bile excretion, raising direct bilirubin in blood.\"",Adults,",
Fungal amylase,Fungal amylase,fAMY,Enzyme Assay,4,9,FAU (fungal amylase units),Fungal amylase is refined from Aspergillus oryzae via deep culture and extraction. It is an endo-amylase rapidly hydrolyzing 1,4-glucosidic bonds in gelatinized starch, amylose," and amylopectin, producing soluble dextrins plus some maltose/glucose. Longer reaction yields maltose-rich syrup.,Used in baked goods, fermented liquor, starch sugar, juice, vegetable processing, alcohol production.,Industries: maltose, high-maltose, brewing, baked foods.,ADI not required (from A. oryzae; FAO/WHO 1994).",
Alkaline phosphatase,Alkaline phosphatase,ALP,Liver Function,35,105,U/L,Elevation seen in biliary obstruction, bone disease; check γ-GT to source.,Use imaging or γ-GT for further workup.,"Adults, Children,ALP elevation common in hepatobiliary or skeletal disease; correlate history.",
Uridylyltransferase,Uridylyltransferase,UTase,Enzyme Assay,,,,Galactose-1-phosphate uridylyltransferase (galT gene) is the key Leloir pathway enzyme catalyzing UDP-glucose + galactose-1-phosphate → glucose-1-phosphate + UDP-galactose. GALT is on 9p13.3; defects cause galactose metabolism disorder (neonatal galactosemia).,Activity <10 leads to galactose-1-phosphate accumulation in liver/brain causing cirrhosis and intellectual disability. Lifelong lactose restriction; avoid absorbable sugars like lactulose.,Neonatal galactosemia screening,"In microbes, engineering galT boosts lactose metabolism; by 2025 seven variants (e.g., Duarte, Indiana) identified.",
Creatine kinase,Creatine kinase,CK,Myocardial Injury Related,18,198,U/L,"CK used to diagnose skeletal muscle and cardiac disease; elevation from strenuous exercise, delivery, IM injections, MI, myocarditis, myositis, dystrophy; low in hyperthyroidism.",Use serum (not plasma); avoid hemolysis and factors that inactivate enzyme (heat/light); avoid CO2 loss altering pH.,Used for diagnosing skeletal muscle and cardiac disorders.,"Normal CK suggests normal muscle/heart; high indicates injury—interpret with other tests., GI, lung, kidney. Cytosolic/mitochondrial enzyme linked to energy turnover, contraction, ATP regeneration. CK activity aids diagnosis of muscle and cardiac disease.,1. Elevated\n(1) Physiologic: post-exercise (more with intensity/duration); postpartum and newborn; procedures (pacemaker, ECT, radiation, CPR, cath, urologic); larger muscle mass in males; IM injections (anesthetics, analgesics, antibiotics, dexamethasone); drugs like clofibrate.\n(2) Pathologic: MI, viral myocarditis, polymyositis, muscular dystrophy, pericarditis, stroke, etc.\n2. Decreased\nHyperthyroidism.,Adults,",
Creatine kinase MB,Creatine kinase MB,CK-MB,Myocardial Injury Related,0,100,%,CK isoenzymes assess CK activity sources. CK-MM (skeletal): 97%-100%; CK-MB (cardiac): 0%-3%; CK-BB (brain): 0.,"Abnormal:\n(1) CK-MM↑ with normal iso ratios but high total CK: primary muscular atrophy, Duchenne dystrophy, seizures.\n(2) CK-MB↑: MI, myocarditis, neonatal asphyxia.\n(3) CK-BB↑: neonatal asphyxia, brain trauma.\nPopulations: newborns, middle/elderly, cardiac disease patients.",Adults,,
Glucose-6-phosphate isomerase,Glucose-6-phosphate isomerase,GPI,Enzyme Assay,50.8,72.9,U/L,Multifunctional enzyme; elevated in rheumatoid arthritis, myocardial infarction, hepatitis," cirrhosis.,If abnormal, further evaluate RA, MI, hepatitis, cirrhosis, etc.,Assessing RA, MI, hepatitis, cirrhosis.,Normally within reference; elevation may relate to many diseases—interpret with other tests.",
Fasting plasma glucose,Fasting plasma glucose,FPG,Glucose Metabolism,3.89,6.1,mmol/L,FPG: plasma glucose after overnight fast ≥8–10h (water allowed), before breakfast; reflects basal insulin/B-cell function; key diabetes test.,Best draw 6–8am; no hypoglycemics," breakfast, or exercise before draw; late draws may misreflect control.,Diabetes screening and glycemic assessment,Normal 3.89–6.1 mmol/L; <2.8 with symptoms → hypoglycemia; 6.1–<7.0 → impaired fasting glucose; ≥7.0 → diabetes (recheck FPG or OGTT).",
Urinary casts,Urinary casts,Casts,Urine Routine,0,3,per uL,Urinary casts are cylindrical aggregates of cells/cell debris/protein. Common types: hyaline, granular, fatty," waxy, cellular. Normal urine may rarely show hyaline; reference 0–3/μL. ≥2–3/HPF suggests renal injury (e.g., nephritis, renal failure).,Clinical clues: hyaline occasionally normal or after exercise/dehydration/fever. Granular casts seen with tubular/glomerular inflammation/degeneration. RBC casts → glomerular/tubular bleeding (acute GN, flare of chronic GN, renal bleed). WBC casts → renal parenchymal infection (renal abscess, interstitial nephritis). Fatty casts → tubular injury (chronic GN, toxic nephropathy, nephrotic syndrome).\nIncreased casts warrant prompt evaluation and renal workup to confirm parenchymal/systemic injury and treat accordingly.,Adults,",
Rheumatoid factor,Rheumatoid factor,RF,Immunology Rheumatology,0,20,IU/ml,Autoantibody targeting denatured IgG Fc (IgA/IgG/IgM/IgE); produced in lymphoid tissues; marker in RA.,"High in autoimmune (RA, SLE, Sjogren, dermatomyositis, scleroderma), acute viral (mono, hepatitis, flu), chronic bacterial (TB, endocarditis), parasites (malaria, schistosomiasis), some tumors.",Adults,High RF suggests autoimmune or infection; interpret with symptoms and other serology.,
Stool routine,Stool routine,Stool,Stool Examination,None,None,Negative,Isolated abnormal finding has limited meaning; with stool WBC may suggest infectious or inflammatory bowel disease.,"If abnormal, see gastroenterology for further testing.",Adults,Abnormal stool may indicate GI infection or inflammation.,
Fecal occult blood,Fecal occult blood,FOBT,Stool Examination,None,None,Negative,"Prone to false positives but important for colorectal cancer screening, especially middle-aged/elderly.",Positive -> colonoscopy or scheduled follow-up to exclude lesions.,Middle-aged and Elderly,FOBT is key for early colorectal cancer detection.,
Argininosuccinate lyase,Argininosuccinate lyase,ASL,Enzyme Assay,0.2,5.3,u,Urea-cycle enzyme richest in liver; rises when hepatocytes are damaged; diagnostic value similar to transaminases.,Pre-test: avoid greasy/high-protein food and alcohol; fast 12h; draw fresh blood.,"Patients with fever, fatigue, anorexia, nausea/vomiting, upper abdominal discomfort, bloating, constipation or diarrhea.","High: marked in viral hepatitis, primary liver cancer; moderate in cholecystitis/cholangitis, mono, CHF, chronic hepatitis, cirrhosis, Hodgkin disease, etc.",
Seminal lactate dehydrogenase X,Seminal lactate dehydrogenase X,LDH-X,Andrology Test,40,,,LDH-X is a sperm-specific enzyme supporting glycolysis and motility; activity correlates with sperm concentration/viability.,"Before collection: abstain 2–7 days, no masturbation/night emission, avoid smoking/alcohol and meds affecting spermatogenesis; wash hands/genitals before collection.","For subfertility/infertility, oligospermia/hematospermia.",LDH-X/LD >40 is normal; reduced activity links to impaired spermatogenesis and lower fertility.,
Hemoglobin A1c,Hemoglobin A1c,HbA1c,Glucose Metabolism,4,6,%,HbA1c is irreversible glycation of hemoglobin by glucose; reflects % of Hb bound to glucose; normal 4–6%.,Accurately reflects long-term glycemic control and is the gold standard metric in diabetes guidelines.,Adults,,
Glycosidase,Glycosidase,GlyCase,Enzyme Assay,4,4.5,U,"Hydrolyzes alpha-1,4 (and slowly alpha-1,6) glucosidic bonds of starch from non-reducing ends; optimal 60–62°C, pH 4.0–4.5.",Control temperature/pH; ensure good contact with starch; mix well or maintain steady flow.,"Alcohol, starch sugar, MSG, antibiotics, citric acid, beer, and liquor production.",Widely used in food industry; non-corrosive to equipment; safe when used properly to improve efficiency.,
Glycogen synthase,Glycogen synthase,GYS,Enzyme Assay,,,Ug,"Rate-limiting enzyme for glycogen synthesis in liver/muscle cytosol; uses UDP-glucose to extend chains; activity regulated by phosphorylation (active dephosphorylated), hormones, 6-phosphoglucose (activator), ATP (inhibitor).",—,Liver and muscle cells,Core insulin-target enzyme for glucose homeostasis; activity abnormalities relate to insulin resistance and type 2 diabetes.,
Cancer antigen 125,Cancer antigen 125,CA125,Tumor Marker,0,35,KU/L,CA125 (MUC16) is a mucin glycoprotein encoded by MUC16; a tumor marker/biomarker that can rise in certain cancers and benign conditions.,"Benign/inflammatory causes: endometriosis, PID, cholecystitis, pancreatitis, pneumonia, ovarian endometrioma, pleural/ascitic effusions—combine with chest/abdominal CT to clarify cause.",,,
Therapy monitoring: drop to normal → good control; drop but >35 → possible residual; unchanged/rising → therapy ineffective," adjust plan.""",Adults,,,,,,,,,
Cancer antigen 15-3,Cancer antigen 15-3,CA15-3,Tumor Marker,0,28,KU/L,CA15-3 is a tumor marker from secretory epithelia (breast, lung, GI," uterus, etc.).,Clinical significance: key marker for breast cancer recurrence/monitoring; can rise in lung, pancreatic, ovarian, colorectal cancers.\nPotential diseases: breast 30–50% elevated; higher with stage/nodal mets; post-op falls, recurrence may rise. Lung: can be high; also secreted by normal airway epithelium. Ovary: high expression in glandular malignancies.\nClinic: breast (breast surgery/oncology), lung (respiratory/oncology/thoracic), ovary (gyne/oncology).\nManagement: treat underlying cancer—surgery/radiation/systemic per disease. Diet: emphasize fruits/veg/whole grains/lean protein; limit high-fat, high-salt, high-sugar foods. Lifestyle: healthy weight, regular aerobic + strength (≥150 min/week), avoid smoking, limit alcohol.,Adults,",
Cancer antigen 19-9,Cancer antigen 19-9,CA19-9,Tumor Marker,0,37,U/ML,Normal <37 U/mL (labs vary). Persistent >5–10× ULN suggests malignancy risk.,,,,
Common in GI adenocarcinoma (stomach, bile duct, colon, rectum); level correlates with size/nodes/metastasis/stage. Also in other adenocarcinomas (breast," NSCLC adeno). Dynamic changes monitor therapy/prognosis: high pre-treatment; fall with response; rise may precede imaging-detected relapse.""",Patients should undergo endoscopy (EGD/colonoscopy), liver/pancreas CT, ultrasound; chest CT and breast US as needed. If mass found, biopsy for diagnosis. Localized disease: surgery; advanced: chemo/targeted/immunotherapy to control progression.,Adults,,
Cancer antigen 242,Cancer antigen 242,CA242,Tumor Marker,0,20,KU/L,CA242 elevation warrants tumor vigilance but requires combined evaluation for diagnosis.,"Malignancy: >3× ULN raises concern, especially pancreas/GI tumors; detection 60%-85% in cancers; pancreatic sensitivity 66%-100%, colorectal 60%-72%.\nBenign: cholangitis, cholecystitis, pancreatitis may mildly elevate, usually not persistent.",Adults,,
Chymotrypsin,Chymotrypsin,CHYM,Enzyme Assay,10,1265,μg/g,Pancreatic protease; rapidly breaks down denatured proteins; stronger than trypsin with lower toxicity and fewer adverse effects. Liquefies viscous sputum (purulent/non-purulent), aids expectoration; also for wound healing post-trauma/surgery and cataract extraction.,Low activity in chronic pancreatitis," cystic fibrosis, small-intestine malabsorption.,Used for chronic bronchitis, bronchiectasis, lung abscess to liquefy sputum.,Works well for patients with excessive sputum, easing expectoration.",
Red blood cells,Red blood cells,RBC,Blood Routine,3.5,5.5,x10^12/L,RBCs are the most numerous blood cells; main oxygen carriers; also buffer acid-base and have immune roles. >400 surface antigens define blood groups.,Low count/quality → anemia, sickle cell," etc.; anemia lowers O2 delivery; sickling blocks flow. RBC indices/morphology aid diagnosis.,Counts vary by species/age/sex/state. Adult men ~4.0–5.5×10^12/L; women ~3.5–5.0×10^12/L; newborns up to 6.0×10^12/L. Major protein is hemoglobin (men 120–160 g/L; women 110–150 g/L).,Origin: multipotent HSC → progenitors → precursors; requires iron, B12, folate. Senescent RBCs cleared by marrow or liver macrophages to bile.",
Delta-aminolevulinic acid dehydratase,Delta-aminolevulinic acid dehydratase,ALAD,Enzyme Assay,139,211,U/ml RBC,ALAD is a lysosomal lyase; activity drops in lead/other heavy metal poisoning.,Prep: avoid fatty/high-protein food/alcohol; fast 12h; proper post-draw pressure.,Use: symptoms like palpitations," headache, dizziness, syncope, coma, seizures, ataxia, respiratory or GI symptoms; children exposed to pencils.,Normal 139–211 U/ml RBC; low suggests lead/heavy metal toxicity—interpret with clinical data.",
Red cell distribution width,Red cell distribution width,RDW,Blood Routine,0,14.5,%,RDW reflects heterogeneity of RBC size; uniform size → low/normal; wide variation → high.,Use with MCV for anemia morphology (e.g., early iron deficiency vs thalassemia).,"Anemia diagnosis/management.,Normal <14.5%.",
Hematocrit,Hematocrit,HCT,Blood Routine,0.4,0.5,None,HCT (PCV) is the RBC volume fraction of whole blood; indirect RBC mass measure; with RBC/Hb calculates indices for anemia typing.,Major determinant of viscosity: higher HCT → higher viscosity.,Assess hemoconcentration (vomiting," diarrhea, burns); very high in polycythemia; secondary rises with hypoxia (newborns, altitude, COPD).,High → concentration/polycythemia; low → anemia/dilution.",
Erythrocyte sedimentation rate,Erythrocyte sedimentation rate,ESR,Inflammatory Response,0,15,mm/h,"Ref: men 0–15, women 0–20 mm/h. Elevated ESR can be physiologic or pathologic; slowing less significant. ESR is adjunct—interpret with other tests. It measures RBC settling speed under set conditions.","See internal medicine/rheumatology; complete CBC, CRP, autoantibodies, imaging to rule out RA, TB, malignancy; report fever, arthralgia, weight loss.",If elevated," see internal medicine/rheum; complete CBC, CRP, autoantibodies, imaging to rule out RA, TB, malignancy, etc.; report fever, arthralgia, weight loss.,Adults,",
Red blood cell count,Red blood cell count,RBC,Blood Routine,4,5.5,10^12/L,Normal: men 4.0–5.5×10^12/L, women 3.5–5.0×10^12/L (age-specific ranges vary). High/low suggests health issues.,High: hypoxia (COPD," altitude), dehydration, polycythemia. Low: anemia, chronic disease, malnutrition, marrow disease.,Adults,",
Cytokeratin 19 fragment,Cytokeratin 19 fragment,CYFRA21-1,Tumor Marker,0,4.46,ng/ml,Tumor marker used in lung and other cancers; elevation alone doesn’t diagnose cancer. Normal ranges vary; typically <3.3 ng/ml; above upper limit suggests possible disease.,"\""1) Diet: balanced; more fruits/veg/fiber; less high-fat/sugar/salt; avoid spicy/irritants.\n2) Emotion: avoid excessive anxiety; marker elevation ≠ definite severe disease; stress affects endocrine/immune.\n3) Avoid harmful exposures: limit carcinogens/radiation (formaldehyde"," benzene); ventilate rooms; choose eco materials; avoid long stays in newly renovated rooms.\""","Adults,",
Hydroxybutyrate dehydrogenase,Hydroxybutyrate dehydrogenase,HBDH,Myocardial Injury Related,90,182,U/L,HBDH with LDH/CK/AST forms the cardiac enzyme panel; important for MI diagnosis. Elevation: MI, active rheumatic/viral myocarditis, hemolytic anemia. Liver disease changes less than cardiac," aiding differentiation.,Test: fasting 12h, morning venous draw.,Diagnosis/differential of MI, myocarditis, hemolysis.,Normal 90–182 U/L; above suggests cardiac/hematologic disease—interpret with other tests.",
Creatinine,Creatinine,Cr,Renal Function,41,73,μmol/L,Elevation suggests reduced GFR or post–strenuous exercise rise.,See nephrology to rule out renal impairment.,"Adults, Children",Interpret with urinalysis.,
Creatine kinase,Creatine kinase,CK,Myocardial Injury Related,18,198,U/L,"CK used to diagnose skeletal muscle and cardiac disease; elevation from strenuous exercise, delivery, IM injections, MI, myocarditis, myositis, dystrophy; low in hyperthyroidism.",Use serum (not plasma); avoid hemolysis and factors that inactivate enzyme (heat/light); avoid CO2 loss altering pH.,Used for diagnosing skeletal muscle and cardiac disorders.,Normal CK suggests normal muscle/heart; high indicates injury—interpret with other tests.,
Enterokinase,Enterokinase,EK,Enzyme Assay,4.5,9.5,ku,Enterokinase is a duodenal heterodimer serine protease (150 kDa; 115k heavy + 35k light). Active pH 4.5–9.5, temp 4–45°C. Activates trypsinogen to trypsin; light chain and DDDDK recognition sequence conserved across vertebrates.,Defect may cause diarrhea," vomiting, edema, poor growth, hypoalbuminemia/anemia.,Protein engineering/post-expression processing,Reflux enrichment can overactivate trypsinogen → acute pancreatitis.",
Colonoscopy,Colonoscopy,Colonoscopy,Imaging Endoscopy,None,None,No unit,Recommended screening ≥50y; detects early cancer/polyps.,Polyps: GI removal and follow-up.,Middle-aged and Elderly,Gold standard for colorectal cancer screening.,
Gastrin-17,Gastrin-17,G-17,Gastric Function,1,15,Pmol/L,"Mild rise 15–30 pmol/L: suggests mild gastritis (e.g., H. pylori); mild dyspepsia; treat cause to normalize.\n30–100: consider atrophic gastritis; reduced acid → feedback G-17 rise; dyspepsia, cancer risk; manage with diet, meds, surveillance endoscopy.\n>100: consider gastrinoma; excess acid → refractory ulcers, diarrhea; often malignant/metastatic—needs prompt diagnosis and combined therapy.\nSeverity also depends on endoscopy/pathology (ulcer/erosion/mass/dysplasia).","1) Diet: light, easy to digest; less spicy/fatty/irritants; more fresh fruits/veg/fiber.\n2) Habits: regular sleep; moderate exercise; avoid strenuous post-meal activity.\n3) Follow-up: monitor G-17 and endoscopy per doctor to adjust treatment and prevent progression.",Adults,,
