Metric Name (CN),English Name,English Abbreviation,Category,Lower Bound,Upper Bound,Unit,Professional Interpretation,Recommendations,Applicable Scope,Health Interpretation,Aliases
Glyceraldehyde-3-phosphate dehydrogenase,Glyceraldehyde-3-phosphate dehydrogenase,GAPDH,Enzyme Assay,2341,428,UL,Glyceraldehyde-3-phosphate dehydrogenase (GAPD) has the systematic name D-glyceraldehyde-3-phosphate: NAD+ oxidoreductase (phosphorylating). It catalyzes the oxidation (dehydrogenation) and phosphorylation of glyceraldehyde-3-phosphate to generate 1,3-bisphosphoglycerate, which is a central step in glycolysis and plays an important role in glucose metabolism.,"The assay method for this enzyme is relatively complex, and enzyme activity is unstable, which presents certain difficulties for routine application.,Diagnosis of diseases such as acute myocardial infarction, acute hepatitis, alcoholic liver disease, cirrhosis, chronic pyelonephritis, multiple myeloma, pneumonia, and emphysema.,Elevated total GAPD activity in serum may be associated with diseases such as acute myocardial infarction, acute hepatitis, alcoholic liver disease, and cirrhosis.",
5'-Nucleotidase,5'-Nucleotidase,5NT,Liver Function,2,17,U/L,5'-Nucleotidase is a hydrolase with low substrate specificity that can act on various nucleotides. This enzyme is mainly derived from the liver and is widely distributed in human tissues such as liver, gallbladder, intestine," brain, heart, and pancreas. It is located on the cytoplasmic membrane, and within the liver, this enzyme is mainly found in the bile canaliculi and sinusoidal membranes. Serum 5NT measurement is mainly used for the diagnosis of hepatobiliary system diseases and the differential diagnosis of bone diseases.,Combined detection of 5NT and ALP helps to distinguish whether elevated serum ALP is caused by hepatobiliary disease or bone disease.,Diagnosis of hepatobiliary system diseases and differential diagnosis of bone diseases.,Elevated 5NT activity in serum is mainly seen in hepatobiliary system diseases, such as obstructive jaundice, primary and secondary liver cancer, and hepatitis. In bone system diseases, such as tumor metastasis, Paget disease of bone, hyperparathyroidism, and rickets, ALP activity is usually elevated, but 5NT is normal.",
AST to ALT ratio,AST to ALT ratio,AST_ALT_ratio,Liver Function,0.8,1.5,,The normal range for AST/ALT is 0.8-1.5. AST/ALT is the ratio of aspartate aminotransferase to alanine aminotransferase, which is one of the common indicators of liver function used to reflect the condition of hepatocyte damage. The increase and decrease of AST/ALT have indicative significance for some liver diseases.,"1. AST/ALT decrease: ALT is mainly distributed in the cytoplasm of hepatocytes, followed by skeletal muscle, kidney, myocardium and other tissues. In acute hepatitis, chronic hepatitis and mild hepatitis, although there is damage to hepatocytes, the mitochondria of hepatocytes remain intact, so only ALT in the cytoplasm is released into the blood, and liver function mainly manifests as ALT elevation, with AST/ALT ratio <1. 2. AST/ALT increase: AST is mainly distributed in the myocardium, followed by liver, skeletal muscle and kidney tissues, and in the liver it is mainly in the cytoplasm and mitochondria of hepatocytes. In severe hepatitis and moderate to severe chronic hepatitis, the mitochondria of hepatocytes are severely damaged, and AST is released from mitochondria and cytoplasm, thus showing AST/ALT ratio ≥1. In patients with cirrhosis and liver cancer, the destruction of hepatocytes is more severe, and mitochondria are also severely damaged, so AST elevation is obvious, AST/ALT ratio >1, or even greater than 2. People with AST/ALT outside the normal range should also pay attention to abstaining from alcohol, avoiding greasy diet, regular work and rest, and avoiding staying up late in daily life. When symptoms of liver function deterioration appear, it is recommended to go to the hospital in time, complete relevant examinations, and receive treatment.","Adults,",
Body mass index,Body mass index,BMI,Physical Measurement,18.5,23.9,,BMI (Body Mass Index) is an important indicator for assessing body weight and health status, widely used in daily health management and medical research.,"BMI less than 18.5 (kg/m^2): Indicates underweight, which may pose risks of malnutrition or poor health. For this population, it is recommended to appropriately increase nutritional intake, especially high-quality protein and high-energy foods, to improve physical condition.",,
BMI between 18.5-23.9 (kg/m^2): Belongs to the normal weight range, indicating that body weight matches health status. Most people in this range can maintain good physical condition and quality of life.,,,,,,,,,,
BMI greater than or equal to 24 (kg/m^2): Indicates overweight or obesity. As BMI values increase, health risks also increase accordingly. Obesity is closely related to various chronic diseases, such as cardiovascular disease, diabetes, and hypertension. Therefore, for overweight and obese populations," active measures should be taken for weight management.""",Adults,,,,
Beta-2 microglobulin,Beta-2 microglobulin,B2M,Renal Function,0.8,2.2,mg/L,Beta-2 microglobulin (β2-MG) is a small molecular protein contained on human cell membranes and is one of the marker substances produced by apoptosis and the immune system under certain disease conditions. Detection of β2-MG levels and reference ranges in humans can guide the screening and diagnosis of certain diseases. β2-MG detection is usually performed through serum or urine samples. The normal reference values for β2-MG vary with age and patient status, and reference ranges differ among different detection methods. Common serum detection reference ranges are approximately 0.8-2.2 mg/L, while the β2-MG reference range in urine is 0-300 mg/L. Simply put," β2-MG levels within a certain range are normal, and exceeding this range may indicate certain diseases, such as acute and chronic kidney disease, AIDS, and certain lymphomas.,Beta-2 microglobulin is mainly metabolized through the kidneys. When renal filtration function decreases, β2-microglobulin levels in the blood will increase. Common causes include chronic kidney disease, glomerulonephritis, and diabetic nephropathy. Treatment methods include controlling the primary disease, such as strict management of blood sugar and blood pressure for patients with diabetes or hypertension. Drug treatment can choose ACE inhibitors, ARB drugs, or diuretics, and dialysis or kidney transplantation when necessary.,Adults,",
C-reactive protein,C-reactive protein,CRP,Inflammatory Response,0,2.87,mg/L,C-reactive protein (CRP) is a protein that rises sharply in plasma when the body is infected or tissue is damaged (acute phase protein). It has the function of activating complement and enhancing phagocytosis by phagocytes, and can clear invading pathogens and damaged, necrotic," and apoptotic tissue cells. C-reactive protein is a non-specific inflammatory marker, and its normal value range varies with different measurement methods, laboratory conditions, and population characteristics. The normal value range of C-reactive protein varies due to multiple factors, but generally can fluctuate within 0-10 mg/L or more specific ranges.,Clinical significance of CRP measurement:",
(1) Rapid elevation occurs within hours after the onset of various acute inflammations, tissue damage, myocardial infarction, surgical trauma, radiation injury, etc., with a tendency to multiply. When the condition improves, it quickly returns to normal, and the magnitude of elevation is positively correlated with the degree of infection. Postoperative patients with elevated CRP should see CRP levels decrease 7-10 days after surgery. If CRP does not decrease or rises again, it may indicate concurrent infection or thromboembolism.,,
(2) CRP has a close correlation with other inflammatory factors, such as total white blood cell count, erythrocyte sedimentation rate, and polymorphonuclear leukocytes. It also has a positive correlation with WBC. It plays an active role in inflammatory reactions, giving the human body non-specific resistance. In patients with disease onset, it can rise earlier than WBC and return to normal quickly, so it has extremely high sensitivity.,,,,,
(3) Helps distinguish respiratory infection types. CRP can be used for differential diagnosis of bacterial and viral infections: CRP levels increase in bacterial infections; while in viral infections, CRP does not increase or increases slightly. Therefore, CRP values can help doctors distinguish the type of respiratory infection and provide targeted medication and treatment.,,,,,,,,,
(4) CRP is elevated in malignant tumor patients. Combined detection of CRP and AFP can be used for differential diagnosis of liver cancer and benign liver diseases, and applied to the assessment of liver cancer efficacy and prognosis. CRP rises before surgery and decreases after surgery, and its response is not affected by radiotherapy, chemotherapy, and corticosteroid treatment, which helps assess tumor progression.,,,,,,
(5) Assess the severity of acute pancreatitis. When CRP is above 250 mg/L, it suggests extensive necrotizing pancreatitis.,,,,,,,,,,
"(6) Using hypersensitive latex-enhanced method to measure CRP can improve the sensitivity of measurement and can be used for predicting the risk of coronary heart disease and myocardial infarction.""",Adults,,,,,,,,,,
DNA polymerase,DNA polymerase,DNAP,Enzyme Assay,0,25,cpm,Genes are the material basis of heredity, determining the biological characteristics of pathogens. Except for individual viruses, all known microorganisms use nucleic acids as genetic material. The gene of hepatitis B virus is deoxyribonucleic acid (DNA)," which is closely related to DNA polymerase necessary for virus replication. Therefore, genetic testing has become a component of hepatitis B testing.,The activity of this enzyme can be detected early in hepatitis B virus infection, even before HBsAg appears. It can serve as a marker for hepatitis B virus replication and infectivity.,Persistent hepatitis B virus infection, acute hepatitis B latent period, initial stage, proliferation period, chronic hepatitis B, chronic hepatitis B with e-antibody positive, high DNA polymerase levels indicate liver function deterioration.,Elevated: Persistent hepatitis B virus infection, acute hepatitis B latent period, initial stage, proliferation period, chronic hepatitis B, chronic hepatitis B with e-antibody positive, high DNA polymerase levels indicate liver function deterioration. Decreased: Chronic hepatitis B with e-antigen positive.",
Glutamate dehydrogenase,Glutamate dehydrogenase,GLUD,Liver Function,2.5,80,U/L,This enzyme is concentrated in the mitochondrial matrix of animal hepatocytes and is one of the key enzymes in the urea cycle. In mammalian metabolism, it is both an important participant in amino acid catabolism and the sole carbon source supplier for ammonia assimilation. Elevated serum L-glutamate dehydrogenase activity can serve as a specific indicator of hepatocyte mitochondrial damage.,In clinical testing," it can be measured by ELISA, enzyme-coupled method, or colorimetric method. When storing, note that lyophilized powder can be stably stored at -20°C for 12 months, and suspension preparations should avoid repeated freeze-thaw cycles.,Widely used in the detection of metabolic products such as ammonia and ketoglutarate, as well as in research fields such as the pathogenesis of hepatic encephalopathy.,Abnormal activity of this enzyme may reflect hepatocyte mitochondrial damage, and the normal activity range is crucial for maintaining amino acid metabolism and ammonia detoxification functions.",
N-acetyltransferase,N-acetyltransferase,NAT,Enzyme Assay,,,,N-acetyltransferase (NAT) is a class of enzymes that catalyze the transfer of acetyl groups between acetyl-CoA and amine substrates, with the systematic classification number E.C.2.3.1.5. This enzyme has substrate specificity for aromatic amines and can modify amine substances through acetyl-CoA-mediated acetylation reactions, or directly transfer acetyl groups between two aromatic amine molecules. The enzymes encoded by NAT1 and NAT2 genes in the human genome are involved in drug metabolism and detoxification," with NAT1 distributed in peripheral tissues and NAT2 mainly present in the liver. The genetic polymorphisms of both lead to individual differences in acetylation metabolic capacity and are listed by the FDA as pharmacogenomic biomarkers.,,Drug metabolism and detoxification,",
Lysozyme,Lysozyme,LZM,Enzyme Assay,3,3,None,By specifically cleaving the 1,4-glycosidic bond between N-acetylmuramic acid and N-acetylglucosamine in peptidoglycan molecules, it disrupts the integrity of Gram-positive bacterial cell walls," leading to osmotic imbalance and cell lysis. It has limited effect on Gram-negative bacteria because their outer membrane structure prevents enzyme molecules from contacting the peptidoglycan layer.,Often combined with Nisin, citric acid and other substances for application in food preservation.,Food preservation,This enzyme has excellent thermal stability under acidic conditions (retains 87% activity after heating at 96°C for 15 minutes at pH 3.0), and the coating solution made by combining it with chitosan has a significant inhibitory effect on the total bacterial count growth in cured meat products.",
Endoproteinase Glu-C,Endoproteinase Glu-C,GluC,Enzyme Assay,4,10,U/mg,V8 protease (EC 3.4.21.19) is a member of the serine protease family, mainly derived from Staphylococcus aureus strain V8. This enzyme can specifically hydrolyze peptide bonds at the carboxyl side of glutamic acid (Glu) or aspartic acid (Asp) residues, and its cleavage sites are affected by buffer pH: it can recognize both Glu and Asp in phosphate buffer at pH 7.8," while it only acts on Glu in ammonium acetate buffer at pH 4.0, with a higher hydrolysis rate for Glu.,This enzyme should be stored at 20 or 28°C, and the lyophilized powder form can be stably stored for 12 months. Protective measures should be taken during use to avoid skin and eye contact.,Protein sequencing, peptide mapping analysis, and proteomics research,This enzyme belongs to hazardous chemicals (H315, H334, etc.), and protective equipment should be worn when handling to prevent skin and eye contact. Purity is ensured through electrophoretic detection during production to avoid animal-derived contamination.",
Gamma-glutamyl transferase,Gamma-glutamyl transferase,GGT,Liver Function,0,50,U/L,Glutamyl transferase (GGT), also known as γ-glutamyl transferase, is mainly present on hepatocyte membranes and microsomes," participating in glutathione metabolism. It is abundant in the kidneys, liver, and pancreas, but serum GGT mainly comes from the hepatobiliary system. GGT is widely distributed on the bile canaliculus side of hepatocytes and throughout the biliary system in the liver, so when hepatic synthesis is hyperactive or bile excretion is blocked, serum GGT increases.,GGT elevation is seen in the following situations:",
1. Hepatobiliary diseases,,,,,,,,,,,
Serum GGT rises highest in patients with intrahepatic or posthepatic bile duct obstruction, reaching 5-30 times normal levels. GGT has higher sensitivity than alkaline phosphatase for obstructive jaundice cholangitis and cholecystitis. GGT levels also increase in patients with primary or secondary hepatitis, and the increase is more significant than other liver enzymes. GGT is moderately elevated in acute hepatitis, fatty liver, and drug poisoning, generally 2-5 times the normal reference value. GGT values can increase in alcoholic cirrhosis and most heavy drinkers. Persistent GGT elevation in patients with chronic hepatitis and cirrhosis suggests unstable condition or worsening trend; gradual decline suggests migration of intrahepatic lesions to inactive areas. In primary liver cancer, serum GGT activity is significantly elevated, especially in determining whether malignant tumor patients have liver metastasis and whether liver cancer has recurred after surgery, with a positive rate of up to 90%.,,,
2. Pancreatic diseases,,,,,,,,,,,
In acute and chronic pancreatitis and pancreatic tumors, it can reach 5-15 times the upper reference limit. GGT values can increase in cystic fibrosis (pancreatic fibrocystic disease) with liver complications.,,,,,,,,,,
3. Other diseases,,,,,,,,,,,
Fatty liver, myocardial infarction, prostate tumors.,,,,,,,,,
4. Drugs,,,,,,,,,,,
Anticonvulsant phenytoin sodium, sedative phenobarbital," or ethanol often cause GGT elevation.""",Adults,,,,,,,,
Gamma-glutamyl transpeptidase,Gamma-glutamyl transpeptidase,GGT,Liver Function,7,45,U/L,Related to biliary tract diseases, alcohol, and drug metabolism induction.,"Hepatobiliary system evaluation is recommended when significantly elevated.,Adults, Children,GGT is an important indicator for assessing biliary function and hepatotoxic reactions.",
Epithelial cells,Epithelial cells,EC,Urine Routine,0,5,/HP,Normal adult urine typically contains 0-5 epithelial cells per high-power field, with women possibly having slightly more but not exceeding 10 (mainly squamous epithelial cells). The number of epithelial cells is affected by sampling methods, body fluid types," physiological status, and other factors, and should be comprehensively judged in combination with specific test items and clinical manifestations.,Increased quantity 1.",
Physiological increase: Female urine contamination (such as vaginal secretions), after intense exercise, or insufficient water intake leading to urine concentration.,,,,,,,,,
Pathological increase:,,,,,,,,,,,
Squamous epithelial cells: Local infections such as urethritis and vaginitis.,,,,,,,,,,,
Transitional epithelial cells: Cystitis, ureteral stones.,,,,,,,,,,
Renal tubular epithelial cells: Acute renal tubular necrosis, renal transplant rejection.,,,,,,,,,,
Morphological abnormalities 2.,,,,,,,,,,,
Keratinized cells: Long-term chronic stimulation (such as sputum from smokers).,,,,,,,,,,,
Nuclear atypia cells: Need to be alert to the possibility of precancerous lesions or malignant tumors," requiring further biopsy confirmation.""",Adults,,,,,,,,,
Neutrophil percentage,Neutrophil percentage,NEU%,Blood Routine,50,75,%,"Usually, elevated neutrophils indicate that the body is in an alert state, such as inflammation or injury. Common possible situations are as follows:",,,,
1. Bacterial infection: Such as tonsillitis, pneumonia, appendicitis, etc. At this time, due to bacterial invasion in the body, neutrophils act as border guards and enter an alert state, leading to their increase.,,,,,
2. Stress response: Burns, myocardial infarction, and particularly intense exercise, etc. At this time, the body is in a state of stress or injury, causing the immune system to activate, which also leads to elevated neutrophils to cope with body damage and stress recovery.,,,,,
3. Hormonal influence: Under some special circumstances, the immune system is affected by hormones (such as during pregnancy, use of glucocorticoid drugs like prednisone), which can also cause immune system activation leading to elevated neutrophils.,,,,,,,,
What changes in the body do decreased neutrophils indicate?,,,,,,,,,,,
Usually, decreased neutrophils often indicate that the body's immune function is insufficient or impaired. Common possible situations are as follows:,,,,,,,,,,
1. Viral infection: Such as influenza and other diseases. Since viruses mainly hide in human cells to disrupt health, neutrophils are not good at clearing pathogens inside cells, leading to limited response (but don't worry, lymphocytes in the body are very good at dealing with viral infections, so viral infections are often accompanied by elevated lymphocytes to enhance combat capability, which is why blood routine tests need to be combined with lymphocyte and other indicators to diagnose diseases).,,,,,,
2. Radiotherapy/chemotherapy: Since radiotherapy/chemotherapy can damage the bone marrow," and the bone marrow serves as the """"training ground"""" for neutrophils", damage will reduce neutrophil production, so patients need to be alert to infections at this time and wait for the body to recover.,,,,,,,,
3. Other situations: Such as autoimmune diseases (lupus erythematosus, rheumatoid arthritis, etc.), the body's immune system is dysregulated, sometimes causing neutrophils to be mistakenly damaged. In addition, some malnutrition and trace element deficiencies can also lead to decreased neutrophil counts.,,,,,,
Note: Although decreased neutrophils indicate immune dysfunction or insufficiency," this does not mean that increasing neutrophils can solve the problem and improve immunity. Do not believe unsubstantiated immunity-boosting supplements on the market.""","Neutrophils serve as the body's immune """"border guards""""", and changes in their numbers can indicate multiple health indicators. There is no need to panic excessively during diagnosis. Cooperating with doctors' diagnosis and taking reasonable treatment can help the body recover quickly.,Adults,,,,,,,
Neutrophil count,Neutrophil count,NEU#,Blood Routine,2.75,7.5,10^9/L,Neutrophil absolute count is a quantitative indicator of neutrophils in white blood cells, accounting for 70% of the total white blood cell count, with the function of phagocytizing bacteria and resisting infection. The normal range is 2.5-7.5×10⁹/L," showing pink neutral granules through hematoxylin-eosin staining. Absolute value elevation is commonly seen in bacterial infections, intense exercise, or pain stimulation; reduction is divided into granulocytopenia (×10⁹/L) and agranulocytosis (×10⁹/L). Causes of neutropenia include drug toxicity, infection, autoimmune diseases, bone marrow failure, or genetic defects.,International guidelines propose stratified intervention and precision repair strategies: mild reduction (1.0-1.5×10⁹/L) adopts observation, cause removal, and nutritional support; moderate to severe reduction (×10⁹/L) uses granulocyte colony-stimulating factor and immunosuppressive therapy. Etiology-oriented treatment covers drug/infection-related (G-CSF combined with antibiotics), hereditary (CRISPR-Cas9 gene therapy), and autoimmune (complement inhibitor eculizumab). Infection prevention and control includes prophylactic medication (oral ciprofloxacin + fluconazole when ANC×10⁹/L) and immunoglobulin therapy.,Adults,",
Hepatitis B e antibody,Hepatitis B e antibody,Anti-HBe,Infectious Disease,,,,Hepatitis B e antibody is the corresponding antibody produced by the body in response to HBeAg stimulation. Like anti-HBc, it also has no protective effect. It was previously thought that anti-HBe positivity indicated the absence of HBV in the body and no infectivity, which was a sign of good prognosis. However," studies have shown that some patients with anti-HBe positivity have never had HBeAg in their serum because HBV gene mutations prevent HBeAg secretion. In this case, although there is no HBeAg in the serum, the virus is still replicating, and the disease may worsen.,Hepatitis B e antibody positivity indicates that viral replication in the body is suppressed to varying degrees, indicating reduced HBV in the blood and decreased infectivity. However, it should be pointed out that hepatitis B e antibody cannot effectively kill the hepatitis B virus. As long as there is hepatitis B virus in the body, treatment is necessary, and if hepatitis B patients with e antibody positivity are not treated in time, they may convert to e antigen positivity.,Chronic hepatitis B patients, asymptomatic hepatitis B surface antigen carriers,Hepatitis B e antibody positivity mainly appears in asymptomatic hepatitis B surface antigen carriers and chronic hepatitis B patients. This indicates that viral replication in the body is suppressed to varying degrees, indicating reduced HBV in the blood and decreased infectivity.",
Hepatitis B core antibody,Hepatitis B core antibody,Anti-HBc,Infectious Disease,Negative,Positive,None,Hepatitis B core antibody is also called anti-HBc, with the English abbreviation HBcAb. After HBV infection, this antibody can be detected in the serum of most people. It is a sensitive serological marker and an early marker of acute hepatitis B infection. It exists in the serum for a long time," and some people have high titers. It is not a protective antibody. HBcAb can be divided into three types: anti-HBcIgM, anti-HBcIgA, and anti-HBcIgG. In HBV infection, these types appear sequentially and also disappear sequentially, with only the IgG type persisting long-term.,Positivity indicates a history of hepatitis B infection or current infection. Free hepatitis B HBcAg generally does not appear in the blood, but it is highly immunogenic. Anti-HBc antibody is the earliest HBV marker antibody in serum after HBV infection, and may be the only detectable serological marker antibody during the """"window period"""" of infection.,Infectious Disease Department, Gastroenterology Department,It is generally believed that low-titer anti-HBc antibody has epidemiological significance, while high-titer anti-HBc antibody is a sign of infection. However, there are exceptions. Anti-HBcIgM type often indicates acute HBV infection, or acute exacerbation of chronic hepatitis B, or chronic hepatitis B entering an active phase. Anti-HBcIgG type often indicates chronic HBV infection or past infection.",
